"Disciplina / Área","Herramienta","Descripción Corta","Descripción Detallada (1ra Persona)","Ahorro de Tiempo (ROI)"
"Arquitectura","1. Generador de Acabados","Suelos automáticos por habitación.","Genero suelos de acabado detectando límites de habitaciones masivamente. Ahorro semanas de modelado manual en proyectos de gran escala.","~80%"
"Arquitectura","2. Muros desde CAD","Levantamiento 3D desde DWG.","Transformo planos 2D en volumetría 3D automáticamente. Levanto la base del edificio en minutos con alta precisión técnica.","~90%"
"Arquitectura","3. Puertas y Ventanas","Inserción masiva por coordenadas.","Coloco cientos de carpinterías automáticamente en sus muros, eliminando el error humano y la fatiga del trabajo repetitivo.","~70%"
"Estructura","4. Refuerzo Estratégico","Acero 3D en elementos tipo.","Automatizo el modelado de acero en elementos típicos vinculando tablas de diseño, manteniendo el archivo ligero y preciso.","~85%"
"Estructura","5. Cimentación desde CAD","Zapatas/Pilotes desde bloques DWG.","Ubico cimentaciones masivas escaneando vínculos de AutoCAD, garantizando que el modelo coincida fielmente con el diseño estructural.","~75%"
"Estructura","6. Unión de Geometría","Unión masiva de elementos de concreto.","Ejecuto uniones automáticas entre vigas, losas y columnas. Garantizo tablas de cuantificación reales sin duplicidades de volumen.","~90%"
"MEP","7. Tuberías desde CAD","Líneas 2D a redes 3D con conexiones.","Traduzco esquemas 2D en redes de instalaciones 3D en minutos, permitiéndome enfocarme en resolver pendientes y colisiones reales.","~75%"
"MEP","8. Soportería Automática","Hangers con detección de estructura.","Instalo kilómetros de soportería técnica en segundos. El script detecta la losa superior y ajusta la longitud del soporte al instante.","~90%"
"MEP","9. Generador de Pasantes","Huecos automáticos por interferencias.","Coloco automáticamente perforaciones en muros y losas donde existen choques, agilizando la coordinación con el equipo estructural.","~80%"
"Doc / Cuant","10. Montaje de Láminas","Composición automática de planos.","Compongo planos ejecutivos vinculando la planta maestra con sus secciones, detalles e isométricos automáticamente en el pie de plano.","~85%"
"Doc / Cuant","11. Estandarizador BEP","Renombrado y carga de datos por Clave.","Vinculo claves de catálogo para renombrar tipos según el BEP e inyectar marca y descripción oficial, logrando una base de datos profesional.","~95%"
"Doc / Cuant","12. Gestor de Cuantificación","Creación masiva de tablas y auditoría.","Genero tablas de cuantificación masivas desde Excel. Sincronizo cantidades entre Revit y el presupuesto para detectar varianzas al instante.","~98%"
"Gestión / Calidad","13. Etiquetado Adaptativo","Orden y filtro inteligente de etiquetas.","Organizo el caos visual: en plantas solo etiqueto tuberías horizontales; en cortes permito ambos sentidos. Alineo todo en zonas limpias.","~85%"
"Gestión / Calidad","14. Monitor de Salud","Auditoría técnica de Warnings y peso.","Extraigo KPIs de estabilidad (advertencias, basura, peso). Detecto errores preventivamente para asegurar la fluidez de los archivos centralizados.","~95%"
"Gestión / Calidad","15. BIM Pre-Flight (Plugin)","Checklist interactivo de 10 puntos críticos.","Plugin de validación final. Obliga al modelador a auditar: Nomenclatura, Ortografía, Interferencias, Tablas, Warnings, Estilos Gráficos (líneas/colores), Purga, Láminas, LOD y Coordenadas.","~100% (Calidad)"